{"contract":"dravora-license-registry/v1","expires_at":"2026-08-03T23:24:06Z","issued_at":"2026-07-27T23:24:06Z","previous_payload_sha256":"sha256:5ad860adcb6d9d38dd7c71ed11e8a6dcdf406069902a508c1987dfe7334d923b","previous_sequence":1,"records":[{"edition":"standalone","license_expires_at":"2026-08-28T23:59:59Z","license_ref":"sha256:17506d31fd893798c6e34d6ffad9a45d7043461ff622ad03b1dc3e3f58604205","not_before":"2026-07-27T21:24:46Z","revision":1,"status":"active","status_changed_at":"2026-07-27T21:27:38Z"},{"edition":"business","license_expires_at":"2026-08-27T23:59:59Z","license_ref":"sha256:28ac465b0f6d7541008e562c77a40327679820d597666c4b0b35302a64689f0e","not_before":"2026-07-27T21:59:07Z","revision":1,"status":"active","status_changed_at":"2026-07-27T22:01:28Z"}],"registry_epoch":"63d1c863-c23a-4a8c-9cd0-8e1274a9f423","registry_id":"dravora-production","sequence":2}