{"contract":"dravora-license-registry/v1","expires_at":"2026-08-03T23:23:26Z","issued_at":"2026-07-27T23:23:26Z","previous_payload_sha256":null,"previous_sequence":0,"records":[{"edition":"business","license_expires_at":"2026-08-27T23:59:59Z","license_ref":"sha256:28ac465b0f6d7541008e562c77a40327679820d597666c4b0b35302a64689f0e","not_before":"2026-07-27T21:59:07Z","revision":1,"status":"active","status_changed_at":"2026-07-27T22:01:28Z"}],"registry_epoch":"63d1c863-c23a-4a8c-9cd0-8e1274a9f423","registry_id":"dravora-production","sequence":1}